sequenceDiagram
    192.168.0.230->>210.93.57.50: len=78 / Ether / IP / TCP 192.168.0.230:58566 > 210.93.57.50:ssh S
    210.93.57.50->>192.168.0.230: len=74 / Ether / IP / TCP 210.93.57.50:ssh > 192.168.0.230:58566 SA
    192.168.0.230->>210.93.57.50: len=66 / Ether / IP / TCP 192.168.0.230:58566 > 210.93.57.50:ssh A
    192.168.0.230->>210.93.57.50: len=90 / Ether / IP / TCP 192.168.0.230:58566 > 210.93.57.50:ssh PA / Raw
    210.93.57.50->>192.168.0.230: len=66 / Ether / IP / TCP 210.93.57.50:ssh > 192.168.0.230:58566 A
    210.93.57.50->>192.168.0.230: len=107 / Ether / IP / TCP 210.93.57.50:ssh > 192.168.0.230:58566 PA / Raw
    192.168.0.230->>210.93.57.50: len=66 / Ether / IP / TCP 192.168.0.230:58566 > 210.93.57.50:ssh A
    192.168.0.230->>210.93.57.50: len=1234 / Ether / IP / TCP 192.168.0.230:58566 > 210.93.57.50:ssh PA / Raw
    210.93.57.50->>192.168.0.230: len=1146 / Ether / IP / TCP 210.93.57.50:ssh > 192.168.0.230:58566 PA / Raw
    192.168.0.230->>210.93.57.50: len=66 / Ether / IP / TCP 192.168.0.230:58566 > 210.93.57.50:ssh A
    210.93.57.50->>192.168.0.230: len=66 / Ether / IP / TCP 210.93.57.50:ssh > 192.168.0.230:58566 A
    192.168.0.230->>210.93.57.50: len=114 / Ether / IP / TCP 192.168.0.230:58566 > 210.93.57.50:ssh PA / Raw
    210.93.57.50->>192.168.0.230: len=66 / Ether / IP / TCP 210.93.57.50:ssh > 192.168.0.230:58566 A
    210.93.57.50->>192.168.0.230: len=466 / Ether / IP / TCP 210.93.57.50:ssh > 192.168.0.230:58566 PA / Raw
    192.168.0.230->>210.93.57.50: len=66 / Ether / IP / TCP 192.168.0.230:58566 > 210.93.57.50:ssh A
    192.168.0.230->>210.93.57.50: len=82 / Ether / IP / TCP 192.168.0.230:58566 > 210.93.57.50:ssh PA / Raw
    210.93.57.50->>192.168.0.230: len=66 / Ether / IP / TCP 210.93.57.50:ssh > 192.168.0.230:58566 A
    192.168.0.230->>210.93.57.50: len=130 / Ether / IP / TCP 192.168.0.230:58566 > 210.93.57.50:ssh PA / Raw
    210.93.57.50->>192.168.0.230: len=66 / Ether / IP / TCP 210.93.57.50:ssh > 192.168.0.230:58566 A
    210.93.57.50->>192.168.0.230: len=130 / Ether / IP / TCP 210.93.57.50:ssh > 192.168.0.230:58566 PA / Raw
    192.168.0.230->>210.93.57.50: len=66 / Ether / IP / TCP 192.168.0.230:58566 > 210.93.57.50:ssh A
    192.168.0.230->>210.93.57.50: len=994 / Ether / IP / TCP 192.168.0.230:58566 > 210.93.57.50:ssh PA / Raw
    210.93.57.50->>192.168.0.230: len=66 / Ether / IP / TCP 210.93.57.50:ssh > 192.168.0.230:58566 A
    210.93.57.50->>192.168.0.230: len=418 / Ether / IP / TCP 210.93.57.50:ssh > 192.168.0.230:58566 PA / Raw
    192.168.0.230->>210.93.57.50: len=66 / Ether / IP / TCP 192.168.0.230:58566 > 210.93.57.50:ssh A
    192.168.0.230->>210.93.57.50: len=130 / Ether / IP / TCP 192.168.0.230:58566 > 210.93.57.50:ssh PA / Raw
    210.93.57.50->>192.168.0.230: len=130 / Ether / IP / TCP 210.93.57.50:ssh > 192.168.0.230:58566 PA / Raw
    192.168.0.230->>210.93.57.50: len=66 / Ether / IP / TCP 192.168.0.230:58566 > 210.93.57.50:ssh A
    192.168.0.230->>210.93.57.50: len=178 / Ether / IP / TCP 192.168.0.230:58566 > 210.93.57.50:ssh PA / Raw
    210.93.57.50->>192.168.0.230: len=114 / Ether / IP / TCP 210.93.57.50:ssh > 192.168.0.230:58566 PA / Raw
    192.168.0.230->>210.93.57.50: len=66 / Ether / IP / TCP 192.168.0.230:58566 > 210.93.57.50:ssh A
    192.168.0.230->>210.93.57.50: len=66 / Ether / IP / TCP 192.168.0.230:58566 > 210.93.57.50:ssh FA
    210.93.57.50->>192.168.0.230: len=66 / Ether / IP / TCP 210.93.57.50:ssh > 192.168.0.230:58566 A
    210.93.57.50->>192.168.0.230: len=66 / Ether / IP / TCP 210.93.57.50:ssh > 192.168.0.230:58566 FA
    192.168.0.230->>210.93.57.50: len=66 / Ether / IP / TCP 192.168.0.230:58566 > 210.93.57.50:ssh A
