sequenceDiagram
    192.168.0.230->>142.250.206.228: len=78 / Ether / IP / TCP 192.168.0.230:64185 > 142.250.206.228:http S
    142.250.206.228->>192.168.0.230: len=74 / Ether / IP / TCP 142.250.206.228:http > 192.168.0.230:64185 SA
    192.168.0.230->>142.250.206.228: len=66 / Ether / IP / TCP 192.168.0.230:64185 > 142.250.206.228:http A
    192.168.0.230->>142.250.206.228: len=211 / Ether / IP / TCP 192.168.0.230:64185 > 142.250.206.228:http PA / Raw
    142.250.206.228->>192.168.0.230: len=66 / Ether / IP / TCP 142.250.206.228:http > 192.168.0.230:64185 A
    142.250.206.228->>192.168.0.230: len=1466 / Ether / IP / TCP 142.250.206.228:http > 192.168.0.230:64185 A / Raw
    142.250.206.228->>192.168.0.230: len=1466 / Ether / IP / TCP 142.250.206.228:http > 192.168.0.230:64185 PA / Raw
    142.250.206.228->>192.168.0.230: len=1466 / Ether / IP / TCP 142.250.206.228:http > 192.168.0.230:64185 A / Raw
    142.250.206.228->>192.168.0.230: len=1466 / Ether / IP / TCP 142.250.206.228:http > 192.168.0.230:64185 PA / Raw
    142.250.206.228->>192.168.0.230: len=782 / Ether / IP / TCP 142.250.206.228:http > 192.168.0.230:64185 PA / Raw
    142.250.206.228->>192.168.0.230: len=1466 / Ether / IP / TCP 142.250.206.228:http > 192.168.0.230:64185 A / Raw
    142.250.206.228->>192.168.0.230: len=1466 / Ether / IP / TCP 142.250.206.228:http > 192.168.0.230:64185 PA / Raw
    142.250.206.228->>192.168.0.230: len=323 / Ether / IP / TCP 142.250.206.228:http > 192.168.0.230:64185 PA / Raw
    192.168.0.230->>142.250.206.228: len=66 / Ether / IP / TCP 192.168.0.230:64185 > 142.250.206.228:http A
    192.168.0.230->>142.250.206.228: len=66 / Ether / IP / TCP 192.168.0.230:64185 > 142.250.206.228:http A
    192.168.0.230->>142.250.206.228: len=66 / Ether / IP / TCP 192.168.0.230:64185 > 142.250.206.228:http FA
    142.250.206.228->>192.168.0.230: len=66 / Ether / IP / TCP 142.250.206.228:http > 192.168.0.230:64185 FA
    192.168.0.230->>142.250.206.228: len=66 / Ether / IP / TCP 192.168.0.230:64185 > 142.250.206.228:http A
